title,date,url
"미니멀라이프_도브 비누, 암웨이 치약_끝까지 쓰는 팁",20250201,https://blog.naver.com/gongganinyeon/223744496917
암웨이 치약 글리스터 성분 비교 분석기,20231016,https://blog.naver.com/hhasd112/223238090260
"암웨이치약 사용 후기, 입안 건조함 해결",20250424,https://blog.naver.com/mmzwoigsu/223844992321
"암웨이 치약, 왜 좋다고 할까? 성분 비교 + 사용후기",20250503,https://blog.naver.com/llhk1004/223853865570
암웨이 치약 정품 가짜 구분법 글리스터 기능,20241211,https://blog.naver.com/misssong720/223689735788
암웨이치약 써보고 계속 쓰게 된 이유,20250424,https://blog.naver.com/whuzfuolx/223844966721
암웨이치약 바꿨더니 애가 알아서 양치해요,20250424,https://blog.naver.com/jbaiddlvz/223844980027
암웨이치약 하루 세 번 써도 입안 편안한 이유,20250424,https://blog.naver.com/xywhgpart/223845008169
암웨이치약 글리스터 치약 프라그제거 미백 충치예방생생후기,20250623,https://blog.naver.com/megohm8743/223908207849
암웨이 치약 짝퉁 정품 제대로 알아보는 방법,20250708,https://blog.naver.com/honest-shop/223926599939
암웨이 치약 글리스터 프로액션 컴플리트 후기,20250214,https://blog.naver.com/f9818/223760785800
암웨이 치약 가짜 피하는법 글리스터 성분 비교,20240830,https://blog.naver.com/enqnenah1/223566427759
쿠팡에서 암웨이 치약을 샀는데.. 짝퉁이라고요?,20250623,https://blog.naver.com/daisykim1987/223908396809
암웨이치약 가짜 확인하는 법 치약 비교 해봄,20240905,https://blog.naver.com/sj12kk13/223573437863
암웨이 여행용치약 건강한 루틴,20250630,https://blog.naver.com/eirtntubwm8444/223916818334
암웨이 마트 브랜드와 제품 설명 글리스터 치약 칫솔 소개,20250430,https://blog.naver.com/lovelybackseol/223851608258
암웨이 치약 좋은 이유 성분분석,20250703,https://blog.naver.com/soda6102/223920750661
"암웨이 글리스터 치약, 치약은 사랑을 싣고...",20250224,https://blog.naver.com/memo-sketch/223771975705
"애터미치약·암웨이 치약, 의약외품 수출·수입 실적 각각 1위... ",20250627,https://blog.naver.com/mino0401/223913429467
암웨이 글리스터 치약 불소 가격 성분 리뉴얼 버전 차이,20240611,https://blog.naver.com/hhasd112/223475759792
"암웨이 치약, 무엇이 다를까요?",20250616,https://blog.naver.com/onewayabo/223900748787
"암웨이 글리스터, 치약 다시 찾는 이유 와 구매 방법",20250615,https://blog.naver.com/honest-shop/223900273947
암웨이 글리스터 치약 리뉴얼! 성분에는 어떤 변화가 있을까요?,20230927,https://blog.naver.com/momguideofficial/223734750842
암웨이치약 구매방법 불소 가짜 글리스터 가격,20240706,https://blog.naver.com/noniu_/223503630064
암웨이치약 써보고 입 냄새 고민 덜었어요,20250424,https://blog.naver.com/qrneyhtzl/223844986431
"암웨이 치약 가격 할인, 리뉴얼제품 본사배송!",20240530,https://blog.naver.com/lsh17092/223463503566
"암웨이 치약 어때요? 사용후기, 글리스터 구매방법",20250517,https://blog.naver.com/rin_i96/223868684696
암웨이 글리스터 프로액션 컴플리트 치약 사용후기~,20241116,https://blog.naver.com/hyunj_jj/223662718386
"암웨이 글리스터 치약 성분 분석, 고르는 팁",20240427,https://blog.naver.com/jeku79/223428751775
암웨이 글리스터 치약과 큐라덴 큐라프록스 엔자이칼 1450,20250506,https://blog.naver.com/if_33/223857082143
암웨이 글리스터 프로액션 컴플리트 치약 200g,20241105,https://blog.naver.com/kdffesdt/223647348574
암웨이치약으로 충치예방부터 구취개선까지 구강관리 이제... ,20250521,https://blog.naver.com/jjj195311/223872334017
암웨이 구강 환경을 건강하게... [글리스터 프로액션컴플리트 치약],20250702,https://blog.naver.com/elloy4463/223919143344
암웨이 치약 3+1 증정 프로모션,20231203,https://blog.naver.com/daisykim1987/223281337144
암웨이 글리스터 오랄케어 추천 / 암웨이 치약 가글... ,20250208,https://blog.naver.com/heartkikii/223753264323
암웨이글리스터 치약 사용후기,20231222,https://blog.naver.com/jins9001/223300498455
"암웨이 치약 글리스터 불소 성분, 함량 비교분석 내돈내산 후기",20240807,https://blog.naver.com/1xxna/223539225480
암웨이 치약/ 글리스터 프로액션 컴플리트 치약 사용후기,20230911,https://blog.naver.com/chlgjsl123/223208234058
암웨이 치약 1년 사용 후기 구매 방법 글리스터,20250510,https://blog.naver.com/rin_i96/223861223032
"암웨이 글리스터 여행용치약 50g( 3개입), 50g, 3개",20250624,https://blog.naver.com/beautiful430/223909587296
"암웨이 치약, 가짜와 어떻게 다를까?",20250628,https://blog.naver.com/newincome/223915013026
암웨이 치약 추천 불소 함량과 성분은 어떨까 솔직후기,20250221,https://blog.naver.com/lazyboy_98/223769057765
암웨이 글리스터 프로액션 컴플리트 치약,20250218,https://blog.naver.com/jaksim_3cho/223765312252
☆암웨이치약☆ 글리스터 멀티 액션 치약,20250428,https://blog.naver.com/millky1202/223848616760
암웨이 치약 20년째 쓰는 이유,20250429,https://blog.naver.com/xday03/223849376536
"정착한 3년째 내돈내산 암웨이 샴푸, 비누, 치약, 클렌저 추천",20240806,https://blog.naver.com/eunjinjejus/223538026662
암웨이 치약 글리스터 사용 후 혀클리너를 안 쓴다 ! 내돈내산,20250222,https://blog.naver.com/healthy___/223769704938
암웨이치약 내돈내산 후기,20241109,https://blog.naver.com/soeun_1001/223653395957
온라인에서 판매되는 암웨이 글리스터 치약. But 큰일이다.,20250413,https://blog.naver.com/saesung2/223831690158
암웨이 치약을 왜 사용해야할까요?,20250405,https://blog.naver.com/onlyamway_/223823084100
선택] 제품 리뷰 : 민티드 고체치약(암웨이 치약 성분 비교),20250408,https://blog.naver.com/honort/223825713248
암웨이치약 제품 판매 전략?,20230930,https://blog.naver.com/ramcess9114/223224783685
맵지않고 순한치약 암웨이 글리스터 치약 가족 치약 선물 치약... ,20240318,https://blog.naver.com/yeonji0106/223386843567
오늘 쿠팡에서 산 암웨이 치약을 신고합니다!!!!!! 너무싸다…..... ,20250622,https://blog.naver.com/aini5133/223908041302
분당 암웨이 샴푸 치약 바디워시 트리트먼트 가격 뉴트리라이프... ,20250321,https://blog.naver.com/rond7/223805063781
암웨이 글리스터 치약 효과 업그레이드된 치약,20231218,https://blog.naver.com/jela77/223296719425
"암웨이 암웨이글리스터치약200-gram, 4개, 200-gram 가격... ",20250310,https://blog.naver.com/vbmrykbm4679026/223790201199
암웨이 치약 유명해서 써봤더니..,20220712,https://blog.naver.com/ziniz77/222808353604
국민치약 암웨이치약 암웨이글리스터치약 무지무지 좋아요^^,20250425,https://blog.naver.com/saesung2/223846323969
4월 첫날 애터미칫솔 암웨이치약 입고,20240401,https://blog.naver.com/ramcess9114/223402385793
암웨이 치약 글리스터 신형 vs 구형 비교,20230522,https://blog.naver.com/juny1105/223108153336
암웨이 치약 만족도,20220104,https://blog.naver.com/mh528sk417/222612859793
맘카페 에서 산 암웨이치약 짝퉁,20220408,https://blog.naver.com/daisykim1987/222694742046
암웨이 치약 프로모션,20230506,https://blog.naver.com/daisykim1987/223095002002
암웨이 치약 비교 &amp; 글리스터 리뉴얼 가짜 구분법,20230609,https://blog.naver.com/zizibezang/223124539850
암웨이 치약 함께 쓰면 더 좋아요,20220524,https://blog.naver.com/zizibezang/222744612835
암웨이 치약 장단점 분석해봤다,20220711,https://blog.naver.com/hhasd112/222804669842
암웨이 치약 안전하게 겟해볼까?,20221225,https://blog.naver.com/ppeunimama/222965527270
밥 안한 날+암웨이 치약,20220918,https://blog.naver.com/sueguy/222878009179
암웨이 치약 쓰다가 이것때문에 바꿈,20211013,https://blog.naver.com/hhasd112/222535860094
시크릿 치약 _엠 프레쉬 미네랄 투스페이스트 vs 암웨이 치약... ,20170223,https://blog.naver.com/tldhs2613/220942388234
암웨이 치약 리뷰 :: 임냄새 제거 대용량 글리스터 치약추천 !,20191024,https://blog.naver.com/hibonggil/221687367335
암웨이 글리스터 치약,20220109,https://blog.naver.com/iamminiijoy/222616749749
암웨이 치약 과 함께 쓰면 좋을 구강케어제품,20220812,https://blog.naver.com/daisykim1987/222846171734
암웨이 치약 글리스터 치약 너무 좋네요,20160408,https://blog.naver.com/lkh0953/220678221829
"암웨이치약65g 6개가 35,400원이라니..",20211217,https://blog.naver.com/ramcess9114/222598043147
암웨이대구ABC/암웨이치약/가벼운선물용,20210426,https://blog.naver.com/sowooko/222323651670
암웨이제품/암웨이치약/뉴트리라이트,20201119,https://blog.naver.com/sowooko/222149082183
암웨이 글리스터 치약 사서 써본 후기 #치약추천,20191031,https://blog.naver.com/verymucho/221694094462
암웨이 글리스터 치약 200g 구매후기,20161115,https://blog.naver.com/jangklod/220859921037
안전한 치약 저희집은 암웨이 치약으로 온가족 치아건강 챙겨요.,20201122,https://blog.naver.com/silsil0707/222151336593
암웨이 치약 200g 2팩,20210519,https://blog.naver.com/ramcess9114/222357349814
뚱뚱한 암웨이 치약도 잘 거치해 주는 치약짜게,20201125,https://blog.naver.com/yedesign01/222154352084
치약추천 _ 암웨이 치약 glister 글리스터 치약 성분/ 가격... ,20191022,https://blog.naver.com/topgear04/221685271451
암웨이 치약 글리스터 사용 후기입니다.,20160403,https://blog.naver.com/nightd/220673107080
암웨이 치약쓰다가 잇몸 미백치약으로 바꿨어요 ! (ft.... ,20200910,https://blog.naver.com/junstar1010/222085998048
해운대 암웨이 플라자 OPEN ! 치약 세제 등 사봤어요,20161020,https://blog.naver.com/rolly_rolly/220840673740
"종합비타민 암웨이 더블엑스, 글리스터 암웨이 치약)",20211108,https://blog.naver.com/my_waltzcat/222562507404
"다녀온 이야기(1) - 암웨이치약, 암웨이종합비타민 더블엑스",20221217,https://blog.naver.com/my_waltzcat/222958551480
암웨이치약가격까지 사버렸어요 ^^;;,20150212,https://blog.naver.com/tmakdlfqnwk/220271113320
"푸딩홀릭 + 암웨이치약,암웨이세제 + 우리집 컴퓨터 아이맥 좋다... ",20150720,https://blog.naver.com/daily_sora/220424989980
따시남이 추천하는 글리스터 암웨이 치약,20150808,https://blog.naver.com/smileyang7/220444851288
사용해보고 작성한 솔직한 상품후기~!암웨이 글리스터 치약~!!,20150101,https://blog.naver.com/vcxzse/220226619601
"1위 덴티스테 치약,  2위  마비스 치약,  3위  암웨이 치약",20200629,https://blog.naver.com/koocci/222015627621
암웨이 치약  믿을 수 있나? 보존제 파라벤의 진실,20190224,https://blog.naver.com/schon2010/221473842164
- 암웨이 치약,20210408,https://blog.naver.com/auprea/222303336283
치약구매후기) 덴티스테 마일드 치약/암웨이치약/ 3M치약,20220707,https://blog.naver.com/agiyasi/222803536948
♥ 암웨이(Amway) -  글리스터멀티액션플로라이드 치약,20141110,https://blog.naver.com/ange613/220176562361
"한 번쯤은 써봤을 암웨이 글리스터 치약, 성분은 한 번이라도... ",20201216,https://blog.naver.com/momguideofficial/223734749376
[세종시 암웨이 치약] 이 치약이 특별한 이유! 효과와 사용 후기,20250222,https://blog.naver.com/jongch92/223769619958
암웨이 치약 판매 1위 추천!!!,20140709,https://blog.naver.com/khasun/220055314054
암웨이 글리스터 치약 불소 성분 가격 가짜 판별 가입 번호,20240519,https://blog.naver.com/hee__0_0/223451041027
암웨이 치약 글리스터 프로모션,20220314,https://blog.naver.com/daisykim1987/222671763271
인기 순위 암웨이 NEW 프로액션 컴플리트 치약 200g x 2개... ,20250124,https://blog.naver.com/vvqbgteds/223736784568
암웨이 글리스터 치약으로 구강건강 고민 해결,20230724,https://blog.naver.com/wellnspark/223164245391
암웨이 치약 효과와 부작용에 대한 진실,20240608,https://blog.naver.com/aidly1996/223472955889
암웨이 글리스터 치약 후기,20240125,https://blog.naver.com/hwlsgl1016/223333445867
미백치약 암웨이 신상품 글리스터 프로액션 컴플리트 치약,20241226,https://blog.naver.com/ywil1013/223706375515
"[인기] 암웨이 글리스터 프로액션 컴플리트 치약, 5개, 200... ",20250208,https://blog.naver.com/every-3000/223752990557
암웨이치약  사서 써본 후기,20241122,https://blog.naver.com/curved506/223669436919
오늘 입고된 암웨이치약,20210419,https://blog.naver.com/ramcess9114/222315328332
신제품 암웨이 치약 글리스터로 건강한 구강 생태계,20230517,https://blog.naver.com/wellnspark/223104103839
[내돈내산] 암웨이 글리스터 치약 &amp; 칫솔 - 여행용으로도 최고,20240719,https://blog.naver.com/hadigo_/223517349888
세계 판매 1위 글리스터 (암웨이 치약 3+1프로모션),20231201,https://blog.naver.com/leeyeonkyoungcrown/223279994671
짝퉁 암웨이치약 비교해봄 ABO후원자번호,20231004,https://blog.naver.com/starchan92/223227855575
치약 배틀 티타드와 암웨이,20230820,https://blog.naver.com/cho4ever/223188552707
큐라덴 암웨이글리스터 오랄비 치실 그리고 덴티스테 치약까지,20240813,https://blog.naver.com/kyonba_u/223545684332
암웨이 치약 역시 대박입니다,20230713,https://blog.naver.com/amwaymoojong/223155549513
"[인기] 암웨이 글리스터 프로액션 컴플리트 여행용 치약, 50... ",20250210,https://blog.naver.com/every-3000/223755335336
암웨이 디톡스 1일차,20250424,https://blog.naver.com/heejeongkwon/223845408332
암웨이 - 글리스터 르미낙트 플로라이드 치약,20220121,https://blog.naver.com/enction/222628081923
"암웨이 치약 가짜 정품 조심하는 방법, 추천",20240927,https://blog.naver.com/optbluesky/223597128639
[암웨이 글리스터치약]스켈링한 느낌♡,20171127,https://blog.naver.com/kjs3703/221149700694
암웨이 치약 좋아요,20240921,https://blog.naver.com/kyung3756/223591433371
뉴트리라이트 암웨이치약 200g 매일의 상쾌함을 위한 필수... ,20240820,https://blog.naver.com/onessbr/223548781818
나의하루. 치약 선택하기!!!!암웨이 글리스터 치약,20161019,https://blog.naver.com/sweetsweetkmy/220839231368
암웨이치약 글리스터 리뉴얼,20230609,https://blog.naver.com/jin2326/223123996219
암웨이 글리스터 치약 깔끔하게 하루 세번 사용하기,20220922,https://blog.naver.com/rhekflaa/222881176638
암웨이치약 : 글리스터 프로액션 컴플리트 치약,20241031,https://blog.naver.com/dodo1139/223640933146
"1위 덴티스테 치약, 2위 티타드 치약, 3위 암웨이 치약",20220302,https://blog.naver.com/koocci/222661846089
암웨이치약 왜 인기가 좋을까,20231102,https://blog.naver.com/issueday-/223252894139
"1위 암웨이 치약, 2위 덴티스테 치약, 3위 티타드 치약",20220502,https://blog.naver.com/koocci/222718520213
"1위 덴티스테 치약,  2위 센소다인 치약, 3위 암웨이 치약",20220602,https://blog.naver.com/koocci/222756774083
"아이가 좋아하는 치약, 암웨이 치약 | 글리스터 르미낙트... ",20230417,https://blog.naver.com/sesimhee/223077539839
효과끝판왕 암웨이글리스터치약 200g 4개 구매 후기 및 리뷰,20250526,https://blog.naver.com/cholgu3/223877744397
암웨이 글리스터 치약이 새롭게 출시됩니다,20230512,https://blog.naver.com/ohyoungok1/223099916078
암웨이 치약 추천 정품 구매하는 방법 (글리스터),20250314,https://blog.naver.com/rin_i96/223795296245
암웨이 치약 글리스터,20220315,https://blog.naver.com/maki07/222672929070
[ 너무착한 암웨이 글리스터 프로액션 컴플리트 치약 200g... ,20250107,https://blog.naver.com/miranaaye/223717016347
암웨이 치약 보존제에 대한 진실,20190307,https://blog.naver.com/schon2010/221482868156
온 가족 치아 건강 암웨이 치약으로 챙겨요.,20230510,https://blog.naver.com/seung-hye0216/223098196786
암웨이 다단계 사업 안하고 피엠쥬스 마시는 이야기,20250420,https://blog.naver.com/bbiyou/223840087872
전세계 판매1위 암웨이 치약과 함께하는 전동칫솔 프로모션,20231128,https://blog.naver.com/leeyeonkyoungcrown/223276582598
암웨이 치약 알고 사용하면 좋은 이유,20220830,https://blog.naver.com/rhekflaa/222861905920
암웨이 치약 '글리스터 프로 액션컴플리트 치약' N년째... ,20240424,https://blog.naver.com/haneul4865/223425433891
암웨이 치약 가짜 조심 짝퉁 조심! 정품 치약 구매하는 방법 추천,20240920,https://blog.naver.com/abo_rin_i/223589338672
경피독 암웨이 치약 샴푸 린스 세제 화장품으로 바꿔야되는 이유,20231220,https://blog.naver.com/donsmell2/223298031657
"암웨이 치약 추천하는 이유? (정품,가짜 판별법)",20231026,https://blog.naver.com/tyco07/223247581707
암웨이 글리스터 치약 리뉴얼 됬네?!?! 미백관리 추천,20230928,https://blog.naver.com/gmpark7057/223221967647
암웨이 치약 써보다가 잇몸 땜에 갈아탔어요,20210806,https://blog.naver.com/rana0418/222459473127
[암웨이 글리스터 치약] 베스트 선물세트 구매 후기,20221208,https://blog.naver.com/sdrikkxt/222949941838
"프로테인영양 가득, 암웨이글리스터치약 200g으로 건강한... ",20250526,https://blog.naver.com/yesmkimm/223877700787
당장 사고싶은 암웨이... 보충) + 암웨이 치약 (200-gram) 1개... ,20250223,https://blog.naver.com/evi5855744/223770645271
암웨이컴플리트 치약으로 건강한 입냄새와 화사한 미소를... ,20250526,https://blog.naver.com/yesmkimm/223877709772
암웨이 글리스터 르미낙트 플로라이드 치약,20200408,https://blog.naver.com/sky04754/221898032126
암웨이 글리스터 치약 성분 불소 함유량 비교,20240913,https://blog.naver.com/misssong720/223582604554
도저히 다른 제품으로 바꿀 수 없는 치약.. 암웨이 글리스터 치약~,20141112,https://blog.naver.com/yedesign01/220179191281
암웨이 칼맥디 치약 치솔 세트,20250625,https://blog.naver.com/ewirpuvpy44725/223910351463
암웨이 치약+구강청결제::마케터가 쓰는 내돈내산 리뷰... ,20250204,https://blog.naver.com/newborn117/223747480782
Amway Glister(암웨이 글리스터) 치약 전성분,20161017,https://blog.naver.com/amistat3/220838319230
천안 암웨이 치약 혈당 글리코다운 한라인쇄,20230524,https://blog.naver.com/papeceo/223111018992
"암웨이 치약, 와이프가 좋다고 하니..",20210501,https://blog.naver.com/manager8888/222330400029
암웨이 치약 글리스터 사용 후기  부드럽고 개운한 느낌이... ,20241107,https://blog.naver.com/jaess2233/223650078954
다단계 애터미 치약 플러스와 암웨이  글리스터 치약 성분과... ,20250207,https://blog.naver.com/healthy_day_/223751950960
암웨이 글리스터 치약,20120617,https://blog.naver.com/scalet70/90145548625
입냄새제거치약 암웨이치약 주방세제추천 공제조합 번호... ,20230310,https://blog.naver.com/nagoya07/223040684589
암웨이 뉴트리 파이토... 보충) + 암웨이 치약 (200-gram) 1개... ,20250204,https://blog.naver.com/forgiveness69400/223747332137
[암웨이 글리스터 트래블 키트✈️(칫솔치약 세트구성)],20240614,https://blog.naver.com/ajw7580/223479105535
암웨이치약 글리스터 내돈내산후기,20211227,https://blog.naver.com/onggi486/222605667006
"암웨이 글리스터 치약... 일상,암웨이 치약,프로텍트 어베드",20161101,https://blog.naver.com/vipbora/220850740888
"암웨이 치약 성분, 글리스터 정품 저렴하게 구매하는 방법 추천",20240920,https://blog.naver.com/rin_i96/223589310438
"암웨이 치약 성분, 정품치약 비회원 구매 방법",20241231,https://blog.naver.com/rin_i96/223710816931
암웨이 치약 괜찮았지만.. (ft. 글리스터),20211228,https://blog.naver.com/yenavant/222606412594
암웨이 치약과 아이칫솔후기,20140402,https://blog.naver.com/elin9179/140209778070
암웨이 치약 200g 3개 써보면 알아요  장점과 단점 분석,20241031,https://blog.naver.com/efficien3046/223641161451
암웨이 글리스터 치약 - 개운합니다☆,20150116,https://blog.naver.com/jj7868jj/220242683287
암웨이치약 오래전부터 사용하며 느낀점,20220415,https://blog.naver.com/rhekflaa/222701168271
"[암웨이] 치약,샴푸,트리트먼트,멀티비타민,스킨,로션... ",20230805,https://blog.naver.com/hxyxox/223175506158
암웨이 후원자번호로 구내염에도 좋은 치약추천,20240319,https://blog.naver.com/myway_amway/223388089332
암웨이 글리스터 치약 가짜 치약 조심!!,20230106,https://blog.naver.com/byeylove30/222976565828
내돈내산추천⭐리뉴얼된 암웨이 글리스터 치약 사용 후기,20231228,https://blog.naver.com/hermes6363/223306081895
★암웨이 글리스터 치약 찐내돈내산 후기!!,20231102,https://blog.naver.com/n1158881/223253799873
글리스터 암웨이 치약 칫솔 마우스워시 프로모션,20230204,https://blog.naver.com/papeceo/223004932684
암웨이 치약 칫솔 마우스워시 등 글리스터 5월17일... ,20230501,https://blog.naver.com/papeceo/223090320127
암웨이 글리스터 치약 성분 꼼꼼하게 비교 체크,20240829,https://blog.naver.com/kiiuhh8876/223565162832
암웨이 여행용 칫솔치약세트 선물용으로 좋아요!,20190705,https://blog.naver.com/jjocojiyi/221578306454
암웨이 치약 200g 4개 비교 분석 나에게 맞는 제품 선택 가이드,20241102,https://blog.naver.com/purchase1657/223644062639
암웨이 글리스터 르미낙트 플로라이드 치약 뽀득뽀득 경험해 보기,20230415,https://blog.naver.com/yellow0200/223074698441
암웨이 글리스터 치약 성분 가격 사용 팁 후기,20240529,https://blog.naver.com/62h3xi2m/223462274520
"암웨이 구강제품1, 암웨이 치약",20190802,https://blog.naver.com/comfort_son/221603323825
암웨이 글리스터 치약 여행용 사이즈 후기 프로액션 컴플리트... ,20250617,https://blog.naver.com/naridamda/223902449522
"암웨이 글리스터 치약 후기, 구취제거와 충치예방에 탁월한... ",20231119,https://blog.naver.com/tyco07/223268748075
"내돈내산] 닥터라파알, 암웨이 치약 , 엔 치약 구매 후기",20230322,https://blog.naver.com/nawps00/223051910883
암웨이 글리스터 치약 리뉴얼 불소치약,20240322,https://blog.naver.com/qikin11/223392130897
암웨이치약과 영국유시몰치약 사용후기,20210822,https://blog.naver.com/choco7533/222480395201
암웨이 치약 프로모션 (경기광주암웨이),20230512,https://blog.naver.com/pjihee77/223099826199
"암웨이 글리스터 프로모션이 시작됩니다 암웨이 치약,칫솔",20230513,https://blog.naver.com/seohs9509/223100983800
암웨이글리스터 치약 사용 후기,20240129,https://blog.naver.com/pppp8989-/223336973791
암웨이 글리스터 치약 후기,20220315,https://blog.naver.com/jbs4431/222672168670
암웨이치약 10년 넘게 사용하는 이유,20240125,https://blog.naver.com/dmstj5855/223333899937
암웨이 프리워시 세탁 세제 어디서사? 지금 사야할때,20250307,https://blog.naver.com/priceton/223787513962
암웨이치약 전 세계에서 인기 폭발? 자세하게 알아보기,20231214,https://blog.naver.com/xieqnq8843/223292508227
암웨이 글리스터치약,20250601,https://blog.naver.com/red610/223885045090
암웨이 치약/글리스터/글리스터 프로액션 컴플리트 치약/온가족... ,20230520,https://blog.naver.com/1190mm/223107038218
치약은 역시...암웨이 글리스터 르미낙트 플로라이드 치약/칫솔... ,20180213,https://blog.naver.com/mukwang79/221208065630
암웨이 치약 글리스터 양치 후 바로 귤 먹었는데 쓴 맛이 안 났다!,20211224,https://blog.naver.com/taijiaa/222603373099
"자주구매(신사양말,액스 AXE 바디 샤워젤, 암웨이 치약, 쿨텍... ",20190902,https://blog.naver.com/nellkc/221636282205
암웨이 치약,20230318,https://blog.naver.com/sunhwa9790/223048562229
[치약추천] 암웨이 글리스터 치약 사용후기,20190222,https://blog.naver.com/gkswlstlf123/221472122639
암웨이 치약 &amp; 암웨이 칫솔,20230529,https://blog.naver.com/snowplay7/223114410773
우리집 치약추천!! 암웨이 글리스터,20150911,https://blog.naver.com/touchground/220478332320
암웨이 글리스터 치약 다른 치약과 다른 이유,20240130,https://blog.naver.com/dmstj5855/223338719680
암웨이 글리스터 치약 진짜 vs 가짜 구분법,20211226,https://blog.naver.com/inrichkim/222605221012
"암웨이 치약  정품 구매 하는 방법, 글리스터 추천",20241017,https://blog.naver.com/rin_i96/223623154143
암웨이 글리스터 치약 불소 함량 성분 비교 후기,20240531,https://blog.naver.com/misssong720/223464341347
칭찬받은 칠순 행사 답례품 암웨이 주방세제 디쉬드롭스+치약 세트,20240128,https://blog.naver.com/misomompj/223336559798
"2023, 암웨이 치약이 새롭게❣️ 바뀝니다 - 국민치약... ",20230329,https://blog.naver.com/fkrud8296/223058889094
암웨이 글리스터 치약 성분 리얼 구매후기,20161026,https://blog.naver.com/yasihendu/220845750072
암웨이 치약 뚜껑 리뉴얼,20240204,https://blog.naver.com/teresiahj/223343600483
